<?xml version="1.0" encoding="UTF-8"?>
<!DOCTYPE ode SYSTEM "content.dtd">
<ode xmlns="http://www.intef.es/xsd/ode" version="2.0">
<userPreferences>
  <userPreference>
    <key>theme</key>
    <value>nova</value>
  </userPreference>
</userPreferences>
<odeResources>
  <odeResource>
    <key>odeId</key>
    <value>2026030310490322P38D</value>
  </odeResource>
  <odeResource>
    <key>odeVersionId</key>
    <value>2026030310490357HZLN</value>
  </odeResource>
  <odeResource>
    <key>exe_version</key>
    <value>3.0</value>
  </odeResource>
</odeResources>
<odeProperties>
  <odeProperty>
    <key>pp_title</key>
    <value>Untitled</value>
  </odeProperty>
  <odeProperty>
    <key>pp_lang</key>
    <value>es</value>
  </odeProperty>
  <odeProperty>
    <key>pp_license</key>
    <value>creative commons: attribution - share alike 4.0</value>
  </odeProperty>
  <odeProperty>
    <key>pp_licenseUrl</key>
    <value>https://creativecommons.org/licenses/by-sa/4.0/</value>
  </odeProperty>
  <odeProperty>
    <key>pp_theme</key>
    <value>nova</value>
  </odeProperty>
  <odeProperty>
    <key>pp_exelearning_version</key>
    <value>v4.0.0-beta1</value>
  </odeProperty>
  <odeProperty>
    <key>pp_modified</key>
    <value>1772531335690</value>
  </odeProperty>
  <odeProperty>
    <key>pp_addExeLink</key>
    <value>true</value>
  </odeProperty>
  <odeProperty>
    <key>pp_addPagination</key>
    <value>false</value>
  </odeProperty>
  <odeProperty>
    <key>pp_addSearchBox</key>
    <value>false</value>
  </odeProperty>
  <odeProperty>
    <key>pp_addAccessibilityToolbar</key>
    <value>false</value>
  </odeProperty>
  <odeProperty>
    <key>pp_addMathJax</key>
    <value>false</value>
  </odeProperty>
  <odeProperty>
    <key>exportSource</key>
    <value>true</value>
  </odeProperty>
  <odeProperty>
    <key>pp_globalFont</key>
    <value>default</value>
  </odeProperty>
</odeProperties>
<odeNavStructures>
<odeNavStructure>
  <odePageId>0dd49edc-9818-434f-8727-3321461bda61</odePageId>
  <odeParentPageId></odeParentPageId>
  <pageName>New page</pageName>
  <odeNavStructureOrder>0</odeNavStructureOrder>
  <odeNavStructureProperties>
    <odeNavStructureProperty>
      <key>titlePage</key>
      <value>New page</value>
    </odeNavStructureProperty>
  </odeNavStructureProperties>
  <odePagStructures>
  </odePagStructures>
</odeNavStructure>
</odeNavStructures>
</ode>