<?xml version="1.0" encoding="UTF-8"?>
<!DOCTYPE ode SYSTEM "content.dtd">
<ode xmlns="http://www.intef.es/xsd/ode" version="2.0">
  <userPreferences>
    <userPreference>
      <key>theme</key>
      <value>base</value>
    </userPreference>
  </userPreferences>
  <odeResources>
    <odeResource>
      <key>odeId</key>
      <value>__ODE_ID__</value>
    </odeResource>
    <odeResource>
      <key>odeVersionId</key>
      <value>__ODE_VERSION_ID__</value>
    </odeResource>
    <odeResource>
      <key>exe_version</key>
      <value>4.x</value>
    </odeResource>
  </odeResources>
  <odeProperties>
    <odeProperty>
      <key>pp_title</key>
      <value>__PROJECT_TITLE__</value>
    </odeProperty>
    <odeProperty>
      <key>pp_lang</key>
      <value>es</value>
    </odeProperty>
    <odeProperty>
      <key>pp_author</key>
      <value>Plantilla IA</value>
    </odeProperty>
    <odeProperty>
      <key>license</key>
      <value>creative commons: attribution - share alike 4.0</value>
    </odeProperty>
    <odeProperty>
      <key>pp_addPagination</key>
      <value>false</value>
    </odeProperty>
    <odeProperty>
      <key>pp_addSearchBox</key>
      <value>false</value>
    </odeProperty>
  </odeProperties>
  <odeNavStructures>
    <odeNavStructure>
      <odePageId>__PAGE_ID__</odePageId>
      <odeParentPageId></odeParentPageId>
      <pageName>__PAGE_TITLE__</pageName>
      <odeNavStructureOrder>1</odeNavStructureOrder>
      <odeNavStructureProperties>
        <odeNavStructureProperty>
          <key>titlePage</key>
          <value>__PAGE_TITLE__</value>
        </odeNavStructureProperty>
        <odeNavStructureProperty>
          <key>visibility</key>
          <value>true</value>
        </odeNavStructureProperty>
      </odeNavStructureProperties>
      <odePagStructures>
        <odePagStructure>
          <odePageId>__PAGE_ID__</odePageId>
          <odeBlockId>__BLOCK_ID__</odeBlockId>
          <blockName>Texto</blockName>
          <iconName></iconName>
          <odePagStructureOrder>1</odePagStructureOrder>
          <odePagStructureProperties>
            <odePagStructureProperty>
              <key>visibility</key>
              <value>true</value>
            </odePagStructureProperty>
            <odePagStructureProperty>
              <key>teacherOnly</key>
              <value>false</value>
            </odePagStructureProperty>
            <odePagStructureProperty>
              <key>allowToggle</key>
              <value>true</value>
            </odePagStructureProperty>
            <odePagStructureProperty>
              <key>minimized</key>
              <value>false</value>
            </odePagStructureProperty>
          </odePagStructureProperties>
          <odeComponents>
            <odeComponent>
              <odePageId>__PAGE_ID__</odePageId>
              <odeBlockId>__BLOCK_ID__</odeBlockId>
              <odeIdeviceId>__IDEVICE_ID__</odeIdeviceId>
              <odeIdeviceTypeName>text</odeIdeviceTypeName>
              <htmlView><![CDATA[<div class="exe-text-template"><div class="textIdeviceContent"><div class="exe-text-activity"><div><p>Esta es una plantilla minima para generar proyectos .elpx con tema base.</p><p class="clearfix"></p></div></div></div></div>]]></htmlView>
              <jsonProperties><![CDATA[{"ideviceId":"__IDEVICE_ID__","textInfoDurationInput":"","textInfoDurationTextInput":"Duración","textInfoParticipantsInput":"","textInfoParticipantsTextInput":"Agrupamiento","textTextarea":"<p>Esta es una plantilla minima para generar proyectos .elpx con tema base.</p>","textFeedbackInput":"Show Feedback","textFeedbackTextarea":""}]]></jsonProperties>
              <odeComponentsOrder>1</odeComponentsOrder>
              <odeComponentsProperties>
                <odeComponentsProperty>
                  <key>visibility</key>
                  <value>true</value>
                </odeComponentsProperty>
                <odeComponentsProperty>
                  <key>teacherOnly</key>
                  <value>false</value>
                </odeComponentsProperty>
              </odeComponentsProperties>
            </odeComponent>
          </odeComponents>
        </odePagStructure>
      </odePagStructures>
    </odeNavStructure>
  </odeNavStructures>
</ode>
